{
  "JobName": "my-project",
  "ProjectName": "my-project",
  "ModelVersion": "1",
  "ModelPackagingJobDescription": "Visual quality inspection model for manufacturing",
  "ModelPackagingMethod": "example-value",
  "Status": "TRAINED",
  "StatusMessage": "TRAINED",
  "CreationTimestamp": "example-value",
  "LastUpdatedTimestamp": "example-value"
}